{
	"include": ["**/*.{ts,tsx,js,jsx}", "**/*.{TS,TSX,JS,JSX}"],
	"exclude": ["**/node_modules/**", "**/dist/**", "**/*.test.*", "**/*.spec.*"],
	"failOn": "high",
	"only": [],
	"rules": {
		"CS-JWT-02": "error",
		"CS-HASH-02": "warn",
		"CS-ENC-01": "warn",
		"CS-ENC-02": "error",
		"CS-HASH-03": "warn"
	},
	"ignore": []
}
